{
  "$schema": "schema/namespace-crosswalk-v0.2.schema.json",
  "identity_sets": {
    "source_unit_ids": "05ae716e3df304cda500e51dc584608535ee6532b6a6e8cee3f2e809451441ad",
    "target_unit_ids": "02cb14f3ddbe894a619fcdcc09990bf7eede3640b7773e64319760731b1faacf"
  },
  "mappings": [
    {
      "cardinality": "one_to_one",
      "evidence_refs": [
        "00_control/CURRENT_CURSOR.json",
        "backend/exports/manifest.json",
        "backend/v2/program-matematika-indonesia-federation-v0.4.4/data/courses.jsonl"
      ],
      "identity_set_sha256": "02cb14f3ddbe894a619fcdcc09990bf7eede3640b7773e64319760731b1faacf",
      "mapping_state": "mapped",
      "reverse_recipe": "lookup payload.native_id",
      "source_namespace": "openintro-statistics/fee25091fb24e89c36296fd67c48c1fcf7a93b6e",
      "source_record_id": "r011/unit/b019/extend-other-statistics",
      "source_record_type": "native_unit",
      "target_namespace": "7790e70a-ae6d-5cf3-b7f5-c53d7d4c0fbd",
      "target_record_id": "urn:uuid:9dbbe9b6-32b0-5490-ae3c-02c57ecb3629",
      "target_record_type": "unit"
    },
    {
      "cardinality": "one_to_one",
      "evidence_refs": [
        "00_control/CURRENT_CURSOR.json",
        "backend/exports/manifest.json",
        "backend/v2/program-matematika-indonesia-federation-v0.4.4/data/courses.jsonl"
      ],
      "identity_set_sha256": "02cb14f3ddbe894a619fcdcc09990bf7eede3640b7773e64319760731b1faacf",
      "mapping_state": "mapped",
      "reverse_recipe": "lookup payload.native_id",
      "source_namespace": "openintro-statistics/fee25091fb24e89c36296fd67c48c1fcf7a93b6e",
      "source_record_id": "r011/unit/b022/section-intro",
      "source_record_type": "native_unit",
      "target_namespace": "7790e70a-ae6d-5cf3-b7f5-c53d7d4c0fbd",
      "target_record_id": "urn:uuid:074876ee-10e5-55de-a3f3-76d104cb9c1d",
      "target_record_type": "unit"
    },
    {
      "cardinality": "one_to_one",
      "evidence_refs": [
        "00_control/CURRENT_CURSOR.json",
        "backend/exports/manifest.json",
        "backend/v2/program-matematika-indonesia-federation-v0.4.4/data/courses.jsonl"
      ],
      "identity_set_sha256": "02cb14f3ddbe894a619fcdcc09990bf7eede3640b7773e64319760731b1faacf",
      "mapping_state": "mapped",
      "reverse_recipe": "lookup payload.native_id",
      "source_namespace": "openintro-statistics/fee25091fb24e89c36296fd67c48c1fcf7a93b6e",
      "source_record_id": "r011/unit/b026/exercise-7",
      "source_record_type": "native_unit",
      "target_namespace": "7790e70a-ae6d-5cf3-b7f5-c53d7d4c0fbd",
      "target_record_id": "urn:uuid:ff024f5e-49b0-56a6-8374-7f2337aae764",
      "target_record_type": "unit"
    },
    {
      "cardinality": "one_to_one",
      "evidence_refs": [
        "00_control/CURRENT_CURSOR.json",
        "backend/exports/manifest.json",
        "backend/v2/program-matematika-indonesia-federation-v0.4.4/data/courses.jsonl"
      ],
      "identity_set_sha256": "02cb14f3ddbe894a619fcdcc09990bf7eede3640b7773e64319760731b1faacf",
      "mapping_state": "mapped",
      "reverse_recipe": "lookup payload.native_id",
      "source_namespace": "openintro-statistics/fee25091fb24e89c36296fd67c48c1fcf7a93b6e",
      "source_record_id": "r011/unit/b028/exercise-32",
      "source_record_type": "native_unit",
      "target_namespace": "7790e70a-ae6d-5cf3-b7f5-c53d7d4c0fbd",
      "target_record_id": "urn:uuid:e4e1ee1e-819b-5802-bef8-ba683e900508",
      "target_record_type": "unit"
    },
    {
      "cardinality": "one_to_one",
      "evidence_refs": [
        "00_control/CURRENT_CURSOR.json",
        "backend/exports/manifest.json",
        "backend/v2/program-matematika-indonesia-federation-v0.4.4/data/courses.jsonl"
      ],
      "identity_set_sha256": "02cb14f3ddbe894a619fcdcc09990bf7eede3640b7773e64319760731b1faacf",
      "mapping_state": "mapped",
      "reverse_recipe": "lookup payload.native_id",
      "source_namespace": "openintro-statistics/fee25091fb24e89c36296fd67c48c1fcf7a93b6e",
      "source_record_id": "r011/unit/exercise/2.18/midrange",
      "source_record_type": "native_unit",
      "target_namespace": "7790e70a-ae6d-5cf3-b7f5-c53d7d4c0fbd",
      "target_record_id": "urn:uuid:1dbc5797-8de7-56f7-a9a1-b3da18c25591",
      "target_record_type": "unit"
    },
    {
      "cardinality": "one_to_one",
      "evidence_refs": [
        "00_control/CURRENT_CURSOR.json",
        "backend/exports/manifest.json",
        "backend/v2/program-matematika-indonesia-federation-v0.4.4/data/courses.jsonl"
      ],
      "identity_set_sha256": "02cb14f3ddbe894a619fcdcc09990bf7eede3640b7773e64319760731b1faacf",
      "mapping_state": "mapped",
      "reverse_recipe": "lookup payload.native_id",
      "source_namespace": "openintro-statistics/fee25091fb24e89c36296fd67c48c1fcf7a93b6e",
      "source_record_id": "r011/unit/exercise/2.2/association_plots",
      "source_record_type": "native_unit",
      "target_namespace": "7790e70a-ae6d-5cf3-b7f5-c53d7d4c0fbd",
      "target_record_id": "urn:uuid:d4347bcf-37df-54d4-acc0-68cbfbc54c3d",
      "target_record_type": "unit"
    },
    {
      "cardinality": "one_to_one",
      "evidence_refs": [
        "00_control/CURRENT_CURSOR.json",
        "backend/exports/manifest.json",
        "backend/v2/program-matematika-indonesia-federation-v0.4.4/data/courses.jsonl"
      ],
      "identity_set_sha256": "02cb14f3ddbe894a619fcdcc09990bf7eede3640b7773e64319760731b1faacf",
      "mapping_state": "mapped",
      "reverse_recipe": "lookup payload.native_id",
      "source_namespace": "openintro-statistics/fee25091fb24e89c36296fd67c48c1fcf7a93b6e",
      "source_record_id": "r011/unit/exercise/3.23/marbles_in_urn",
      "source_record_type": "native_unit",
      "target_namespace": "7790e70a-ae6d-5cf3-b7f5-c53d7d4c0fbd",
      "target_record_id": "urn:uuid:45125eba-5c72-5462-a7a0-e45eea4d0284",
      "target_record_type": "unit"
    },
    {
      "cardinality": "one_to_one",
      "evidence_refs": [
        "00_control/CURRENT_CURSOR.json",
        "backend/exports/manifest.json",
        "backend/v2/program-matematika-indonesia-federation-v0.4.4/data/courses.jsonl"
      ],
      "identity_set_sha256": "02cb14f3ddbe894a619fcdcc09990bf7eede3640b7773e64319760731b1faacf",
      "mapping_state": "mapped",
      "reverse_recipe": "lookup payload.native_id",
      "source_namespace": "openintro-statistics/fee25091fb24e89c36296fd67c48c1fcf7a93b6e",
      "source_record_id": "r011/unit/exercise/4.21/dreidel",
      "source_record_type": "native_unit",
      "target_namespace": "7790e70a-ae6d-5cf3-b7f5-c53d7d4c0fbd",
      "target_record_id": "urn:uuid:1b5e2055-0086-5392-9187-f5923f5836ce",
      "target_record_type": "unit"
    },
    {
      "cardinality": "one_to_one",
      "evidence_refs": [
        "00_control/CURRENT_CURSOR.json",
        "backend/exports/manifest.json",
        "backend/v2/program-matematika-indonesia-federation-v0.4.4/data/courses.jsonl"
      ],
      "identity_set_sha256": "02cb14f3ddbe894a619fcdcc09990bf7eede3640b7773e64319760731b1faacf",
      "mapping_state": "mapped",
      "reverse_recipe": "lookup payload.native_id",
      "source_namespace": "openintro-statistics/fee25091fb24e89c36296fd67c48c1fcf7a93b6e",
      "source_record_id": "r011/unit/guided-exercise/ch03-sec3.1-06",
      "source_record_type": "native_unit",
      "target_namespace": "7790e70a-ae6d-5cf3-b7f5-c53d7d4c0fbd",
      "target_record_id": "urn:uuid:61397df2-63c2-5365-8b53-10d2a19d7729",
      "target_record_type": "unit"
    },
    {
      "cardinality": "one_to_one",
      "evidence_refs": [
        "00_control/CURRENT_CURSOR.json",
        "backend/exports/manifest.json",
        "backend/v2/program-matematika-indonesia-federation-v0.4.4/data/courses.jsonl"
      ],
      "identity_set_sha256": "02cb14f3ddbe894a619fcdcc09990bf7eede3640b7773e64319760731b1faacf",
      "mapping_state": "mapped",
      "reverse_recipe": "lookup payload.native_id",
      "source_namespace": "openintro-statistics/fee25091fb24e89c36296fd67c48c1fcf7a93b6e",
      "source_record_id": "r011/unit/guided-exercise/ch03-sec3.1-07",
      "source_record_type": "native_unit",
      "target_namespace": "7790e70a-ae6d-5cf3-b7f5-c53d7d4c0fbd",
      "target_record_id": "urn:uuid:56e74069-ae6a-5937-8290-7aec8cd8411c",
      "target_record_type": "unit"
    },
    {
      "cardinality": "one_to_one",
      "evidence_refs": [
        "00_control/CURRENT_CURSOR.json",
        "backend/exports/manifest.json",
        "backend/v2/program-matematika-indonesia-federation-v0.4.4/data/courses.jsonl"
      ],
      "identity_set_sha256": "02cb14f3ddbe894a619fcdcc09990bf7eede3640b7773e64319760731b1faacf",
      "mapping_state": "mapped",
      "reverse_recipe": "lookup payload.native_id",
      "source_namespace": "openintro-statistics/fee25091fb24e89c36296fd67c48c1fcf7a93b6e",
      "source_record_id": "r011/unit/guided-solution/ch03-sec3.3-01",
      "source_record_type": "native_unit",
      "target_namespace": "7790e70a-ae6d-5cf3-b7f5-c53d7d4c0fbd",
      "target_record_id": "urn:uuid:57b825f2-0ce8-518b-909a-c7bed0fc8a1f",
      "target_record_type": "unit"
    },
    {
      "cardinality": "one_to_one",
      "evidence_refs": [
        "00_control/CURRENT_CURSOR.json",
        "backend/exports/manifest.json",
        "backend/v2/program-matematika-indonesia-federation-v0.4.4/data/courses.jsonl"
      ],
      "identity_set_sha256": "02cb14f3ddbe894a619fcdcc09990bf7eede3640b7773e64319760731b1faacf",
      "mapping_state": "mapped",
      "reverse_recipe": "lookup payload.native_id",
      "source_namespace": "openintro-statistics/fee25091fb24e89c36296fd67c48c1fcf7a93b6e",
      "source_record_id": "r011/unit/source-label/oneSampleMeansWithTDistribution",
      "source_record_type": "native_unit",
      "target_namespace": "7790e70a-ae6d-5cf3-b7f5-c53d7d4c0fbd",
      "target_record_id": "urn:uuid:1fdf2a6c-b80e-5ad7-b440-3523be2c406a",
      "target_record_type": "unit"